{
  "taskId": "video_pipeline_api_001",
  "taskType": "video",
  "videoUrl": "https://cos.example.local/video/video_pipeline_api_001/output.mp4",
  "coverUrl": "https://cos.example.local/video/video_pipeline_api_001/cover.jpg",
  "duration": 120,
  "summary": "证明勾股定理，并解释为什么这个方法成立。",
  "knowledgePoints": [
    "math 核心概念",
    "题干信息提取",
    "分步讲解"
  ],
  "resultId": "video_result_video_pipeline_api_001",
  "completedAt": "2026-04-06T12:00:46Z",
  "aiContentFlag": true,
  "title": "证明勾股定理",
  "providerUsed": {
    "llm": ["stub-llm"],
    "tts": ["stub-tts"]
  }
}
